{
  "corpus_version": "1.0.0",
  "config_version": 2,
  "description": "Ordered evaluation of experiment rules: pause, holdout, rollout and weighted variant assignment, with the legacy rendering of each result. Expected terminal fields and legacy cells are exhaustive. Hash evidence lists every hash an evaluation draws. White-box rows replace every drawn hash through a private seam; parser rows run at the parser boundary.",
  "cases": [
    {
      "id": "v2_experiment.ordering.split",
      "family": "ordering",
      "flag": {
        "key": "example-display-key",
        "name": "Example display name",
        "active": true,
        "deleted": false,
        "requested": true
      },
      "config": {
        "version": 2,
        "return_type": "string",
        "default_value": "default",
        "rules": [
          {
            "id": "11111111-1111-4111-8111-111111111111",
            "rule_type": "experiment",
            "targeting": {
              "properties": []
            },
            "paused": false,
            "rollout_percentage": 100,
            "on_rollout_miss": "continue",
            "assignment_algorithm": "sha1_60_v1",
            "seed": "example-split",
            "assign_by": "person",
            "variants": [
              {
                "key": "control",
                "weight": 50,
                "value": "blue"
              },
              {
                "key": "test",
                "weight": 50,
                "value": "green"
              }
            ]
          }
        ]
      },
      "context": {
        "identifier": "person-3",
        "properties": {
          "plan": "pro"
        },
        "properties_complete": true,
        "timezone": "UTC",
        "explicit_exact_matching": true,
        "now": "2024-03-31T12:00:00Z"
      },
      "expected": {
        "status": "success",
        "value": "green",
        "reason": "experiment_split",
        "rule": {
          "id": "11111111-1111-4111-8111-111111111111",
          "rule_type": "experiment",
          "index": 0
        },
        "variant": "test"
      },
      "legacy": {
        "enabled": true,
        "variant": "green",
        "value": "green",
        "payload": null
      },
      "hash_evidence": [
        {
          "use": "variant",
          "prefix": "example-split.",
          "identifier": "person-3",
          "salt": "variant",
          "input_utf8_hex": "6578616d706c652d73706c69742e706572736f6e2d3376617269616e74",
          "sha1_hex": "f31f53c835e3ac066ef4237aa9d552ce225ea64a",
          "first_15_hex": "f31f53c835e3ac0",
          "n": "1094925824678574784",
          "hash01_binary64_hex": "3fee63ea7906bc76",
          "boundaries_binary64_hex": [
            "3fe0000000000000",
            "3ff0000000000000"
          ]
        }
      ]
    },
    {
      "id": "v2_experiment.ordering.paused",
      "family": "ordering",
      "flag": {
        "key": "example-display-key",
        "name": "Example display name",
        "active": true,
        "deleted": false,
        "requested": true
      },
      "config": {
        "version": 2,
        "return_type": "string",
        "default_value": "default",
        "rules": [
          {
            "id": "11111111-1111-4111-8111-111111111111",
            "rule_type": "experiment",
            "targeting": {
              "properties": []
            },
            "paused": true,
            "rollout_percentage": 100,
            "on_rollout_miss": "continue",
            "assignment_algorithm": "sha1_60_v1",
            "seed": "example-split",
            "assign_by": "person",
            "variants": [
              {
                "key": "control",
                "weight": 50,
                "value": "blue"
              },
              {
                "key": "test",
                "weight": 50,
                "value": "green"
              }
            ]
          }
        ]
      },
      "context": {
        "identifier": "person-example",
        "properties": {
          "plan": "pro"
        },
        "properties_complete": true,
        "timezone": "UTC",
        "explicit_exact_matching": true,
        "now": "2024-03-31T12:00:00Z"
      },
      "expected": {
        "status": "success",
        "value": "default",
        "reason": "experiment_paused",
        "rule": {
          "id": "11111111-1111-4111-8111-111111111111",
          "rule_type": "experiment",
          "index": 0
        }
      },
      "legacy": {
        "enabled": true,
        "variant": "default",
        "value": "default",
        "payload": null
      }
    },
    {
      "id": "v2_experiment.ordering.paused_before_holdout",
      "family": "ordering",
      "flag": {
        "key": "example-display-key",
        "name": "Example display name",
        "active": true,
        "deleted": false,
        "requested": true
      },
      "config": {
        "version": 2,
        "return_type": "string",
        "default_value": "default",
        "rules": [
          {
            "id": "11111111-1111-4111-8111-111111111111",
            "rule_type": "experiment",
            "targeting": {
              "properties": []
            },
            "paused": true,
            "rollout_percentage": 100,
            "on_rollout_miss": "continue",
            "assignment_algorithm": "sha1_60_v1",
            "seed": "example-split",
            "assign_by": "person",
            "variants": [
              {
                "key": "control",
                "weight": 50,
                "value": "blue"
              },
              {
                "key": "test",
                "weight": 50,
                "value": "green"
              }
            ],
            "holdout": {
              "id": null,
              "seed": "example-holdout",
              "exclusion_percentage": 100
            }
          }
        ]
      },
      "context": {
        "identifier": "person-example",
        "properties": {
          "plan": "pro"
        },
        "properties_complete": true,
        "timezone": "UTC",
        "explicit_exact_matching": true,
        "now": "2024-03-31T12:00:00Z"
      },
      "expected": {
        "status": "success",
        "value": "default",
        "reason": "experiment_paused",
        "rule": {
          "id": "11111111-1111-4111-8111-111111111111",
          "rule_type": "experiment",
          "index": 0
        }
      },
      "legacy": {
        "enabled": true,
        "variant": "default",
        "value": "default",
        "payload": null
      }
    },
    {
      "id": "v2_experiment.ordering.paused_targeting_miss",
      "family": "ordering",
      "flag": {
        "key": "example-display-key",
        "name": "Example display name",
        "active": true,
        "deleted": false,
        "requested": true
      },
      "config": {
        "version": 2,
        "return_type": "string",
        "default_value": "default",
        "rules": [
          {
            "id": "11111111-1111-4111-8111-111111111111",
            "rule_type": "experiment",
            "targeting": {
              "properties": [
                {
                  "key": "plan",
                  "type": "person",
                  "operator": "exact",
                  "value": [
                    "free"
                  ]
                }
              ]
            },
            "paused": true,
            "rollout_percentage": 100,
            "on_rollout_miss": "continue",
            "assignment_algorithm": "sha1_60_v1",
            "seed": "example-split",
            "assign_by": "person",
            "variants": [
              {
                "key": "control",
                "weight": 50,
                "value": "blue"
              },
              {
                "key": "test",
                "weight": 50,
                "value": "green"
              }
            ]
          },
          {
            "id": "22222222-2222-4222-8222-222222222222",
            "rule_type": "targeted_release",
            "targeting": {
              "properties": []
            },
            "value": "targeted"
          }
        ]
      },
      "context": {
        "identifier": "person-example",
        "properties": {
          "plan": "pro"
        },
        "properties_complete": true,
        "timezone": "UTC",
        "explicit_exact_matching": true,
        "now": "2024-03-31T12:00:00Z"
      },
      "expected": {
        "status": "success",
        "value": "targeted",
        "reason": "targeting_match",
        "rule": {
          "id": "22222222-2222-4222-8222-222222222222",
          "rule_type": "targeted_release",
          "index": 1
        }
      },
      "legacy": {
        "enabled": true,
        "variant": "targeted",
        "value": "targeted",
        "payload": null
      }
    },
    {
      "id": "v2_experiment.ordering.paused_before_rollout_miss",
      "family": "ordering",
      "flag": {
        "key": "example-display-key",
        "name": "Example display name",
        "active": true,
        "deleted": false,
        "requested": true
      },
      "config": {
        "version": 2,
        "return_type": "string",
        "default_value": "default",
        "rules": [
          {
            "id": "11111111-1111-4111-8111-111111111111",
            "rule_type": "experiment",
            "targeting": {
              "properties": []
            },
            "paused": true,
            "rollout_percentage": 0,
            "on_rollout_miss": "continue",
            "assignment_algorithm": "sha1_60_v1",
            "seed": "example-split",
            "assign_by": "person",
            "variants": [
              {
                "key": "control",
                "weight": 50,
                "value": "blue"
              },
              {
                "key": "test",
                "weight": 50,
                "value": "green"